Job ID,Job Title,Organization,Salary,Location,Closing Date,Position Title,Job Description,Organization,Division,City,Language of Position(s),Job Term,Job Code,Salary,Posting Status,Address,Compensation Group,Schedule,Category,Posted on,Note
218080,Senior Administration Advisor-Mainframe (1),Ministry of Public and Business Service Delivery and Procurement,"$1,852.71  - $2,314.51 Per Week","Oshawa, Central Region; Kingston, Peterborough, East Region; North Bay, Thunder Bay, North Region; Toronto, Toronto Region; Guelph, St Catharines, West Region","Thursday, January 2, 2025 11:59 pm EST",Senior Administration Advisor-Mainframe,"GovTechON - Infrastructure Technology Services, is seeking a Senior Administration Advisor – Mainframe, to provide authoritative, specialized, senior-level technical leadership and coordination for ITS's mainframe operating systems administration and software products. You will also provide ongoing monitoring and service activities, analytical services and recommendations to enhance the mainframe hosting service capabilities that support ITS's multi-platform, multi-protocol 24/7/365, mission-critical computer processing operations environment.
OPS Commitment to Diversity, Inclusion, Accessibility, and Anti-Racism:
We are committed to build a workforce that reflects the communities we serve and to promote a diverse, anti-racist, inclusive, accessible, merit-based, respectful and equitable workplace.
We invite all interested individuals to apply and encourage applications from people with disabilities, Indigenous, Black, and racialized individuals, as well as people from a diversity of ethnic and cultural origins, sexual orientations, gender identities and expressions.
Visit the
OPS Anti-Racism Policy
and the
OPS Diversity and Inclusion Blueprint
pages to learn more about the OPS commitment to advance racial equity, accessibility, diversity, and inclusion in the public service.
We offer employment accommodation across the recruitment process and all aspects of employment consistent with the requirements of Ontario's
Human Rights Code
. Refer to the ""How to apply"" section if you require a disability-related accommodation.
What can I expect to do in this role?
In this role, you will:
• Provide specialized, senior-level technical leadership for assigned mainframe systems administration, software design, development, review, change, implementation and optimization projects pertaining to SA/MVS system automation products.
• Provide clients with Tier 3 incident and problem management services that involve specialized, senior-level technical performance analyses using interpretative reasoning to evaluate specific very diverse problems which may be broad in scope.
• Provide specialized senior-level operating systems software consulting support, technical advice and guidance to staff, operating systems administrators and application developers on system capabilities, operation, functionality and development.
• Develop and deliver technical education programs for clients and work teams to support them in dealing with change resulting from operating systems software decisions.
• Contribute specialized technical expertise and coordination for risk management activities, such as contingency and disaster recovery planning, testing, documentation and related staff education and training.
• Review standards in IT architecture plans and strategies and recommend additions or changes.
• Perform a wide variety of specialized, senior-level duties. For example, monitoring and reporting on vendor performance, verifying that vendor deliverables have completely met contract requirements before Manager authorizes payment, alerting management to defaults, and recommending and implementing solutions.
How do I qualify?
Mandatory
• Must be familiar with mainframe system automation best practices, system administration and support for automation products such as System Netview or SA/MVS and REXXas well as expert knowledge of various tools, for installing, monitoring and maintaining software in z/OS such as: Z/OS , RMF, SMP/E, REXX, TSO, JCL, and Netview.
Specialized Knowledge:
• You have excellent interpersonal skills with a strong interest in the z/OS platform support role.
• You are capable of maintaining the z/OS environment, which primarily includes: keeping the operating system and program products at their most current level, performance and tuning, debugging and troubleshooting system related issues, and providing technical support to the application development community.
• You must have expert knowledge of and hands-on experience working with the latest generation of IBM mainframes and the more recent releases of the z/OS operating system. You must also provide expert guidance to the application development community and the data centre operations staff, in all areas of operating systems functionality, as well as mainframe program products usage.
• You have hands-on experience in TSO, JCL and automation products.
• You have knowledge of ITS's computing centres' mainframe and system technologies, services, products, service providers and vendors, including all software (e.g. CA, IBM, BMC tools, etc.); hardware (computers, servers, storage, etc.).
• You have knowledge of IT Infrastructure Library (ITIL) and RACF processes, terms and definitions, to develop and implement approved solutions and manage technical change consistently in accordance with best practices and accepted standards.
• You have knowledge of client needs and business environment, to define current and future technical scope of work with a more senior analyst and/or the Manager, and assess and advise on the need for operating systems software change.
• You have knowledge of contingency and disaster recovery planning and testing to contribute specialized technical knowledge and co-ordination for planning, testing and education purposes.
• You have knowledge of technical training and education techniques to provide data, reports, problem resolution, education and information.
Research, Analytical and Planning Skills:
• You possess reasoning, planning, analysing and assessing skills to assess client needs, system usage, performance and capacity to meet needs.
• You have the ability to research and assess technology and methodology options, develop cost-benefit analyses and provide business-focused technical inputs and recommendations to support technology planning.
• You have troubleshooting, incident and problem management skills, with strong tolerance for ambiguity to analyze technical problems and provide viable solutions for specific difficult incidents and problems that may be very diverse and broad in scope.
Leadership and Organizational Skills:
• You possess group leadership skills to develop and encourage cross-functional project teamwork, good morale and high performance.
• You have the ability to balance competing demands and manage diverse concurrent technical projects.
• You are able to coordinate, consult, guide and manage diverse working relationships (e.g. with management, project team members, application developers, network administrators, vendors, etc.) to present, discuss, inform and develop support for recommendations.
Communication Skills:
• You have written and oral communication skills to write technical documentation protocols and standards.
• You have the ability to write, explain and present complex technical reports and recommendations for audiences and/or decision-makers whose area of expertise may not be in operating systems software.
• You are able to establish effective working relationships and provide instruction for less experienced team members, define needs to and instruct vendors and provide draft policies and procedures.
Computer Skills:
• You are able to utilize common office software (e.g. MS Office) in order to provide reports, recommendations, statistical and presentation materials, etc. for management.",Ministry of Public and Business Service Delivery and Procurement,"GovTechON- Infrastructure Technology Services (ITS), Data Centre Operations(DCO)","Guelph, Kingston, North Bay, Oshawa, Peterborough, St Catharines, Thunder Bay, Toronto",English,1 Permanent,17162 - Systems Officer 6,"$1,852.71  - $2,314.51 Per Week*
          *Indicates the salary listed as per the OPSEU Collective Agreement.",Open,"1 English Permanent, 222 Jarvis St, Toronto, Toronto Region or 17 Gable Ln, Kingston, East Region or 300 Water St, Peterborough, East Region or 1000 Southgate Dr, ON, Guelph, West Region or 301 St Paul St, St Catharines, West Region or 200 First Ave W, North Bay, North Region or 33 King St W, Oshawa, Central Region or 1 Stone Rd W, Guelph, West Region or 435 James St S, Thunder Bay, North Region",Ontario Public Service Employees Union,6,Information Technology,"Wednesday, December 4, 2024",
222836,Senior Economic Advisor (1),"Ministry of the Environment, Conservation and Parks","$82,217.00  - $121,155.00 Per Year","Toronto, Toronto Region","Friday, January 10, 2025 11:59 pm EST",Senior Economic Advisor,"Join Our Team as a Senior Economic Advisor!
Are you passionate about applying your economic expertise to support environmental policy development and evaluation? If you are ready to lead and collaborate on impactful projects, consider this opportunity to join our team!
OPS Commitment to Diversity, Inclusion, Accessibility, and Anti-Racism:
We are committed to build a workforce that reflects the communities we serve and to promote a diverse, anti-racist, inclusive, accessible, merit-based, respectful and equitable workplace.
We invite all interested individuals to apply and encourage applications from people with disabilities, Indigenous, Black, and racialized individuals, as well as people from a diversity of ethnic and cultural origins, sexual orientations, gender identities and expressions.
Visit the
OPS Anti-Racism Policy
and the
OPS Diversity and Inclusion Blueprint
pages to learn more about the OPS commitment to advance racial equity, accessibility, diversity, and inclusion in the public service.
We offer employment accommodation across the recruitment process and all aspects of employment consistent with the requirements of Ontario's
Human Rights Code
. Refer to the ""How to apply"" section if you require a disability-related accommodation.
What can I expect to do in this role?
In this role, you will:
• Provide strategic advice, economic expertise, analyses, and inform options on a broad range of environmental economic analyses and assessments;
• Oversee, lead and coordinate project teams in the economic research, analysis, assessment and econometric modelling of environmental policy proposals and initiatives;
• Evaluate economic and environmental trends to support government decision-making
• Develop briefing materials to support evidence-based policy decisions for senior management;
• Build and maintain networks with various partners to exchange information, gather input on policies and programs, and resolve issues.
How do I qualify?
Knowledge of Economic Theory:
You have:
• Knowledge of economic theory/analysis and research principles;
• Knowledge of methodologies of economic forecasting and econometric modelling, and their application in a policy and planning environment;
• Knowledge of the theories, principles and practices of environmental management, and general knowledge of environmental issues and trends;
• Knowledge of strategic directions, policy objectives and government priorities.
Analytical & Problem Solving Skills
• You can conduct research to identify data sources, select modelling and analytical techniques to perform analyses, and evaluate the implications of findings;
• You can plan and develop studies or projects that involve economic modelling and forecasting;
• You can assess and evaluate the environmental and financial impact of proposed policy changes, recommend changes and appropriate responses;
• You can develop and maintain econometric models to interpret environmental, economic and related socio-economic trends.
Communication and Consultation Skills:
• You can prepare and present a wide range of complex material including briefing materials for senior management, policy papers and studies;
• You have strong presentation skills;
• You have consultation and persuasion skills to build and foster partnerships.
Project Management Skills
• You have project management skills to conduct multiple concurrent projects;
• You demonstrate strong leadership in guiding colleagues and project teams;
• You can successfully coordinate competing priorities and deadlines.
Computer Skills
• You have experience using advanced computer software programs and tools, including econometric software.","Ministry of the Environment, Conservation and Parks",Climate Change and Resiliency Division / Environmental Economics Branch,Toronto,English,1 Temporary - up to 18 months,6A007 - Policy06,"$82,217.00  - $121,155.00 Per Year",Open,"1 English Temporary, duration up to 18 months, 438 University Ave, Toronto, Toronto Region","Association of Management, Administrative and Professional Crown Employees of Ontario",6,Policy and Analysis,"Wednesday, December 4, 2024",
223396,Senior Nurse (1),Ministry of the Solicitor General,"$1,684.03  - $2,418.51 Per Week","Penetanguishene, Central Region","Friday, December 20, 2024 11:59 pm EST",Senior Nurse,"Consider Your Next Career with the Ministry of the Solicitor General, Ontario Public Service!
The Ontario Public Service is one of the largest employers in the province, with a wide range of exciting career opportunities. We believe in the core values of trust, fairness, diversity, excellence, creativity, collaboration, efficiency and responsiveness. We invite you to join our teams!
We are seeking a Senior Nurse to provide group leadership to the health care team and ensure effective delivery of comprehensive health care and nursing services to offenders at the Central North Correctional Centre.
OPS Commitment to Diversity, Inclusion, Accessibility, and Anti-Racism:
We are committed to build a workforce that reflects the communities we serve and to promote a diverse, anti-racist, inclusive, accessible, merit-based, respectful and equitable workplace.
We invite all interested individuals to apply and encourage applications from people with disabilities, Indigenous, Black, and racialized individuals, as well as people from a diversity of ethnic and cultural origins, sexual orientations, gender identities and expressions.
Visit the
OPS Anti-Racism Policy
and the
OPS Diversity and Inclusion Blueprint
pages to learn more about the OPS commitment to advance racial equity, accessibility, diversity, and inclusion in the public service.
We offer employment accommodation across the recruitment process and all aspects of employment consistent with the requirements of Ontario's
Human Rights Code
. Refer to the ""How to apply"" section if you require a disability-related accommodation.
What can I expect to do in this role?
In this role, you will:
• Oversee the day to day operation of a health care unit by managing nursing assignments and schedules, assigning daily duties, and coordinating nursing functions
• Provide health care to patients, including emergency care, acute care, crisis intervention, health teaching and counselling services
Participate in inter-disciplinary health care planning, and facilitate evidence-based approaches and outcomes
• Assist with the implementation and evaluation of health care interventions
• Practise in accordance with the security requirements of the institution
• Practise in accordance with the College of Nurses of Ontario Practice Standards and Ministry expectations
How do I qualify?
Mandatory
• You are a Registered Nurse in good standing with the College of Nurses of Ontario
Nursing Knowledge and Experience
• You have proven knowledge and competency in the applications of the College of Nurses professional standards and guidelines, best practice guidelines, nursing theories and practices, and evidence-based clinical health care to provide and ensure the effective delivery of quality nursing services to offenders in secured custody
• You have knowledge and expertise to assess emergency situations and implement appropriate treatment measures
Technical Knowledge
• You can interpret and apply knowledge of relevant legislation (e.g., Regulated Health Professions Act, Health Care Consent Act, Protection of Privacy Act) to deliver services in compliance with health care standard, and ensure consent to treatment, confidentiality of health care records, and safety of offenders and security of health care areas
Group Leadership and Supervisory Skills
• You can coordinate and direct the day-to day operations of health care unit, and provide group leadership and supervision to a team of nursing professionals
• You can manage nursing schedule activities, and provide mentoring, guidance and support to the team
Communications, Analytical and Conflict Resolution Skills
• You have proven interpersonal, oral communication and conflict resolution skills to provide consultation and resolve issues with stakeholders and staff
• You have excellent analytical and problem-solving skills, and you demonstrate good judgement
• You can liaise effectively with interdisciplinary team to assess and respond to routine and emergency situations
• You can collaborate with management in the development of health care policies and procedures
• You are proficient with computer software applications
Hours of Work
• The hours of work are 40 hours per week. You are expected to work rotating shifts in a health care unit that provides 7 days per week service, up to 24 hours a day.",Ministry of the Solicitor General,Central North Correctional Centre,Penetanguishene,English,1 Permanent,"C50054 - Nurse 3, General (COR)","$1,684.03  - $2,418.51 Per Week*
          *Indicates the salary listed as per the OPSEU Collective Agreement.",Open,"1 English Permanent, 1501 Fuller Ave, Penetanguishene, Central Region, Vulnerable Sector Check, Credit History Check, Local Police Databases Search, PIP/NICHE/RMS",Ontario Public Service Employees Union,4-7,Health and Social Services,"Wednesday, December 4, 2024",
