Job ID,Job Title,Organization,Salary,Location,Closing Date,Position Title,Job Description,Organization,Division,City,Language of Position(s),Job Term,Job Code,Salary,Posting Status,Address,Compensation Group,Schedule,Category,Posted on,Note
223709,Student – Adult and Youth Probation Jobs (19),Various Ministries,$17.20  - $18.05 Per Hour,"Mississauga, Oshawa, Whitby, Central Region; Cornwall, Kingston, Ottawa, East Region; North Bay, South Porcupine, Thunder Bay, North Region; Scarborough, Toronto, Toronto Region; Guelph, Hamilton, London, St Catharines, West Region","Saturday, January 18, 2025 11:59 pm EST",Student – Adult and Youth Probation Jobs,"Are you a student or recent graduate looking for an opportunity to build your career over the summer? Are you passionate about making a difference? The Summer Employment Opportunities program provides opportunities to obtain valuable work experience, gain transferable skills, and build professional networks.
Submit an application today for these summer employment opportunities:
• Adult Probation and Parole Assistant
• Youth Probation Assistant
Note: When submitting an application for this posting, please indicate on the application form which job type(s) you are applying to. You can apply to multiple opportunities.
Information to assist you with the application process is available on the
Summer Employment Opportunities website.
This job posting represents multiple positions within different ministries and at various locations across Ontario. Certain cities may be located in distant or remote areas in Ontario and may not be accessible by public transit. Carefully review locations through
Google Maps
and select ONLY those locations that you are able to travel to and work in. You can select up to 10 locations.
Notes:
Relocation expenses and/or accommodations are not covered by ministries.
The number of positions to be filled is approximate and subject to change.
Please use your legal name when applying to the job ad.
Summer placements are typically full-time (working 36.25hrs/week or 40 hrs/week). However some part-time placements MAY be available based on mutual agreement between the hiring manager and student, if operationally feasible. Please inquire at the interview stage.
OPS Commitment to Diversity, Inclusion, Accessibility, and Anti-Racism:
We are committed to build a workforce that reflects the communities we serve and to promote a diverse, anti-racist, inclusive, accessible, merit-based, respectful and equitable workplace.
We invite all interested individuals to apply and encourage applications from people with disabilities, Indigenous, Black, and racialized individuals, as well as people from a diversity of ethnic and cultural origins, sexual orientations, gender identities and expressions.
Visit the
OPS Anti-Racism Policy
and the
OPS Diversity and Inclusion Blueprint
pages to learn more about the OPS commitment to advance racial equity, accessibility, diversity, and inclusion in the public service.
We offer employment accommodation across the recruitment process and all aspects of employment consistent with the requirements of Ontario's
Human Rights Code
. Refer to the ""How to apply"" section if you require a disability-related accommodation.
What can I expect to do in this role?
Adult Probation and Parole Assistant Work Description:
These positions will be located at Adult Probation and Parole facilities/offices. As an Adult Probation and Parole Assistant, you will have the opportunity to work on some or all of the following activities:
Assist probation and parole officers in coordinating case management.
Support the development and delivery of ministry in-house programs.
Apply research, analytical, and writing skills to prepare a variety of reports.
Plan, organize, coordinate and manage daily assigned work.
Youth Probation Assistant Work Description:
These positions will be located in probation offices. As a Youth Probation Assistant, you may have the opportunity to work on some or all of the following activities:
Assist Probation Officers in a variety of office tasks, such as maintaining client logs, preparing custody packages and documentation, and liaising with facilities and probation staff.
Work directly with youth to assist in their rehabilitation.
Complete administrative duties, including intake interviews, and collecting and updating client data.
Assist in the facilitation of custody placements, including working with community agencies, sharing information, and coordinating placements under the guidance of the Provincial Director.
How do I qualify?
Mandatory
You must meet
all
eligibility criteria by the first day of employment (contracts begin between May and July):
Student Status:
You must be enrolled in a secondary or post-secondary institution (currently or for the fall semester) OR you must have graduated within the past six months (for example, if you graduated in December, you can apply for and start a summer student position up until June of the following year).
Age:
You must be a minimum of 15 years of age. There is no maximum age limit. Some positions require candidates to be a minimum of 18 years of age as of the first day of employment.
Residency:
You must be a resident of Ontario during the term of employment.
Work Status:
You must be legally entitled to work in Canada and have a valid Canadian Social Insurance Number (SIN) for the full duration of your summer employment.
Application:
Applications are only accepted online by clicking the ""Apply Online"" button. Your application should describe how you meet the knowledge and skill requirements outlined on this ad.
Job Requirements for Adult Probation and Parole Assistant:
Communication and Interpersonal Skills
You apply your excellent written communication skills to prepare a variety of documents in support of the case management of offenders.
You apply your excellent interpersonal and communication skills to interact with professionals, justice sector officials, and community partners.
You apply your verbal, written, and active listening communication skills to utilize community resources and assist with case management services.
You apply your initiative and interpersonal skills to work collaboratively within a multi-disciplinary team.
Technical Skills and Knowledge
You apply your experience using Microsoft Office applications, such as Word (word processing) and Excel (spreadsheets), as well as databases, email, and the internet to conduct research and prepare a variety of documents.
Analytical and Organizational Skills
You apply your organizational and coordination skills to support and assist in the case management of adult offenders.
You apply your administrative and coordination skills by complying with all ministry administrative standards and directives.
You are able to monitor and assist in the enforcement of court and parole conditions requirements.
You work independently or as part of a team; you plan, organize, and prioritize your work to meet competing deadlines.
Other Requirements
You are at least 18 years of age
Job Requirements for Youth Probation Assistant:
Communication and Interpersonal Skills
You apply your excellent written communication skills to prepare a variety of documents in support of the case management of offenders.
You apply your excellent interpersonal and communication skills to interact with professionals, justice sector officials, and community partners.
You apply your verbal, written, and active listening communication skills to utilize community resources and assist with case management services.
You apply your initiative and interpersonal skills to work collaboratively within a multi-disciplinary team.
Technical Skills and Knowledge
You apply your experience using Microsoft Office applications, such as Word (word processing) and Excel (spreadsheets), as well as databases, email, and the internet to conduct research and prepare a variety of documents.
You have knowledge of various sociological issues impacting youth (e.g. poverty, family violence and abuse, sexual abuse, substance abuse, gang mentality, peer-on-peer violence, racial issues, etc.).
You have knowledge of social work principles and cognitive behavioural interventions.
You have knowledge of relevant legislation, including the Youth Criminal Justice Act (YCJA).
Analytical and Organizational Skills
You apply your investigative, problem-solving, and analytical skills to recommend appropriate interventions for youth based on their risk and need requirements.
You work with Probation Officers to assess criminogenic risk, make enforcement decisions, and prepare court reports related to disposition of cases.
You apply your organizational, time management, and coordination skills to manage a varied work schedule with deadlines.
You comply with all ministry administrative standards and directives, including confidentiality provisions.
You work independently or as part of a team; you plan, organize, and prioritize your work to meet competing deadlines.
Other student and recent graduate opportunities
See what other summer opportunities are currently available!
Also, check out all the
other student and new recent graduate opportunities
offered within the Ontario Public Service.",Various Ministries,Various Divisions and Branches,"Cornwall, Guelph, Hamilton, Kingston, London, Mississauga, North Bay, Oshawa, Ottawa, Scarborough, South Porcupine, St Catharines, Thunder Bay, Toronto, Whitby",English,19 Temporary positions of varying contract length over the summer,"Student 1 - Student Level 1, Student 2 - Student Level 2","$17.20  - $18.05 Per Hour*
          *Indicates the salary listed as per the OPSEU Collective Agreement.",Open,,Ontario Public Service Employees Union,"N/A , N/A",Corrections and Enforcement,"Wednesday, December 4, 2024",
223817,Student – Agriculture Development (Field Crops Jobs) (14),Various Ministries,$18.05  - $18.05 Per Hour,"Lindsay, East Region; Guelph, London, Ridgetown, West Region","Saturday, January 11, 2025 11:59 pm EST",Student – Agriculture Development (Field Crops Jobs),"Are you a student or recent graduate looking for an opportunity to build your career over the summer? Are you passionate about making a difference?
The Summer Employment Opportunities program provides opportunities to obtain valuable work experience, gain transferable skills, and build professional networks.
LEARN:
Jump start your career, whether you want to learn business skills, use your French language skills, help out in a lab, or work outdoors. Put the knowledge you've acquired at school into action.
GROW:
Enhance your skills and expand your network by working on projects, leading initiatives and sharing your ideas. Transfer the skills you learn to your future school and work experiences.
CONTRIBUTE:
In addition to advancing your professional and personal skills, you will also give back to your community. Spend your summer working to support the interests of Ontarians!
Information to assist you with the application process is available on the
Summer Employment Opportunities website (opens in a new tab).
This job posting represents multiple positions within different ministries and at various locations across Ontario. Certain cities may be located in distant or remote areas in Ontario and may not be accessible by public transit. Carefully review locations through
Google Maps (opens in a new tab)
and select ONLY those locations that you are able to travel to and work in.
Notes:
Relocation expenses and/or accommodations are not covered by ministries.
The number of positions to be filled is approximate and subject to change.
Please use your legal name when applying to the job ad.
Summer placements are typically full-time (working 36.25hrs/week or 40 hrs/week). However some part-time placements MAY be available based on mutual agreement between the hiring manager and student, if operationally feasible. Please inquire at the interview stage.
OPS Commitment to Diversity, Inclusion, Accessibility, and Anti-Racism:
We are committed to build a workforce that reflects the communities we serve and to promote a diverse, anti-racist, inclusive, accessible, merit-based, respectful and equitable workplace.
We invite all interested individuals to apply and encourage applications from people with disabilities, Indigenous, Black, and racialized individuals, as well as people from a diversity of ethnic and cultural origins, sexual orientations, gender identities and expressions.
Visit the
OPS Anti-Racism Policy
and the
OPS Diversity and Inclusion Blueprint
pages to learn more about the OPS commitment to advance racial equity, accessibility, diversity, and inclusion in the public service.
We offer employment accommodation across the recruitment process and all aspects of employment consistent with the requirements of Ontario's
Human Rights Code
. Refer to the ""How to apply"" section if you require a disability-related accommodation.
What can I expect to do in this role?
Agriculture Development Branch fosters innovative, competitive, and sustainable agricultural production in Ontario. The branch efficiently and effectively delivers Knowledge Translation and Transfer programs for the horticulture, livestock, and field crops sectors across Ontario. A team of highly qualified staff promote high quality agricultural production through the application of best management practices, on-farm quality assurance programs and plant and animal health strategies.
As a student working in the Field Crops section of the Agriculture Development Branch, you may have the opportunity to work in one of these specialty areas:
Crop Pathology (only available in Ridgetown)
Crop Entomology (only available in Ridgetown)
Weed Management
Soil Management / Soil Fertility
Field Cropping Systems
Corn Crops (only available in Guelph)
Cereal Crops (only available in Guelph)
Soybean Crops
Canola & Edible Bean Crops
Forage & Grazing Crops (only available in Lindsay)
Digital Agriculture Media or Agriculture Communications
Please indicate which specialty area(s) you have interest in on your application form.
Be sure to outline any relevant knowledge/skills you have in the area(s) on your cover letter and resume.
If you are the successful candidate, your area(s) of interest will be taken into consideration but not guaranteed. Final placement will be dependent on interview results and operational need.
NOTE:
you can select up to 3 locations on your application form. Please ONLY select locations you are able to commute to and work in.
Work description:
Assist with summer research and demonstration projects conducted by Field Crop Specialists.
Activities may include the set-up and maintenance (weeding, planting, etc.) of research plots focused on production practices, soil health, weed control, pest management, and fertility etc., collection/entering of data and preparation of written reports.
Field work may include farm tours, field scouting, identification and monitoring of insects, weeds and crop diseases.
Assist staff with the collection and analysis of on-farm samples and data for research projects.
Assist staff to conduct literature reviews and develop written reports and presentation materials on key initiatives and industry issues.
Assist in the coordination of events and programs (e.g. workshops, demonstrations, field days etc.) working with key stakeholders and clients in delivery of programs and information.
Training will be provided on research methods, technology transfer, and working in the public sector.
Office work may include assisting with the production of technical information such as newsletters, updating web pages, blogs, scanning images, etc.
How do I qualify?
Mandatory
You must meet
all
eligibility criteria by the first day of employment (contracts begin between May and July):
Student Status:
You must be enrolled in a secondary or post-secondary institution (currently or for the fall semester) OR you must have graduated within the past six months (for example, if you graduated in December, you can apply for and start a summer student position up until June of the following year).
Age:
You must be a minimum of 15 years of age. There is no maximum age limit.
Residency:
You must be a resident of Ontario during the term of employment.
Work Status:
You must be legally entitled to work in Canada and have a valid Canadian Social Insurance Number (SIN) for the full duration of your summer employment.
Application:
Applications are only accepted online by clicking the ""Apply Online"" button. Your application should describe how you meet the knowledge and skill requirements outlined on this ad.
Knowledge and Skill Requirements
You have teamwork skills to work with various internal and external stakeholders and to work within a multi-disciplinary team
You have written communication skills to prepare a variety of documents (e.g. reports, factsheets, and articles).
You are familiar with computer-based software applications including MS Word and MS Excel to perform data entry, conduct analysis, prepare reports, track and compile information
You can work in an outdoor environment with physical activity involved
You work independently or as part of a team; you plan, organize and prioritize your work to meet competing deadlines
Familiarity with plants, farming and crop production is an asset but is not required. Training will be provided in these areas.
Other Requirements
You have a valid G licence prior to the start of summer employment (contracts may start as early as April) and you are willing to travel to rural locations
You are willing and able to work in outdoor environments in a variety of weather conditions, with some physical activity involved including light lifting, in an office and remotely (home office).
With proper safety and training measures, you are able to work in an environment where pest control products have been applied
Other student and recent graduate opportunities
See what other summer opportunities are currently available!
Also, check out all the
other student and new recent graduate opportunities
offered within the Ontario Public Service.",Various Ministries,Various Divisions and Branches,"Guelph, Lindsay, London, Ridgetown",English,14 Temporary positions of varying contract length over the summer,Student 2 - Student Level 2,"$18.05  - $18.05 Per Hour*
          *Indicates the salary listed as per the OPSEU Collective Agreement.",Open,,Ontario Public Service Employees Union,N/A,Agriculture,"Wednesday, December 4, 2024",
223816,Student – Agriculture Development (Horticulture Jobs) (21),Various Ministries,$18.05  - $18.05 Per Hour,"Guelph, Harrow, Ridgetown, Simcoe, Vineland, West Region","Saturday, January 11, 2025 11:59 pm EST",,,,,,,,,,,,,,,,
223814,Student – Agriculture Development (Livestock Jobs) (12),Various Ministries,$18.05  - $18.05 Per Hour,"Lindsay, East Region; Elora, Guelph, Stratford, West Region","Saturday, January 11, 2025 11:59 pm EST",,,,,,,,,,,,,,,,
223674,Student – Agriculture Jobs (7),Various Ministries,$18.05  - $18.05 Per Hour,"Guelph, West Region","Monday, February 10, 2025 11:59 pm EST",,,,,,,,,,,,,,,,
223748,Student – Architectural Conservation Assistant (1),Various Ministries,$18.05  - $18.05 Per Hour,"Toronto, Toronto Region","Tuesday, February 4, 2025 11:59 pm EST",,,,,,,,,,,,,,,,
223747,Student – Assistant Archaeologist (1),Various Ministries,$18.05  - $18.05 Per Hour,"Toronto, Toronto Region","Tuesday, February 4, 2025 11:59 pm EST",,,,,,,,,,,,,,,,
223730,Student – Data Analyst Assistant (43),Various Ministries,$17.20  - $18.05 Per Hour,"Kingston, Peterborough, East Region; North Bay, North Region; Downsview, North York, Toronto, Toronto Region; St Catharines, West Region","Monday, January 27, 2025 11:59 pm EST",,,,,,,,,,,,,,,,
223830,Student – Data Analyst Assistant (Bilingual English/French) (1),Various Ministries,$18.05  - $18.05 Per Hour,"Ottawa, East Region","Monday, January 27, 2025 11:59 pm EST",,,,,,,,,,,,,,,,
223755,Student – Drinking Water Assistant (4),Various Ministries,$17.20  - $18.05 Per Hour,"Chesterville, Deloro, East Region; Sarnia, Stratford, West Region","Tuesday, February 11, 2025 11:59 pm EST",,,,,,,,,,,,,,,,
223781,Student – Emergency Management Assistant (20),Various Ministries,$17.20  - $18.05 Per Hour,"Oshawa, Central Region; Ottawa, Pembroke, Peterborough, East Region; Ignace, Kenora, North Bay, Sudbury, Sault Ste Marie, Timmins, North Region; Downsview, Toronto, Toronto Region; London, St Catharines, West Region","Tuesday, January 28, 2025 11:59 pm EST",,,,,,,,,,,,,,,,
223760,Student – Enforcement Assistant (5),Various Ministries,$17.20  - $18.05 Per Hour,"Georgetown, Central Region; North Bay, Sudbury, North Region; Toronto, Toronto Region; London, West Region","Tuesday, February 11, 2025 11:59 pm EST",,,,,,,,,,,,,,,,
223759,Student – Engineering Assistant (26),Various Ministries,$17.20  - $18.05 Per Hour,"Kingston, Ottawa, East Region; North Bay, Thunder Bay, North Region; Toronto, Toronto Region; London, St Catharines, West Region","Tuesday, January 28, 2025 11:59 pm EST",,,,,,,,,,,,,,,,
223757,Student – Environmental Assistant (38),Various Ministries,$17.20  - $18.05 Per Hour,"Ajax, Burlington, Barrie, Dorset, Midhurst, Central Region; Cornwall, Kemptville, Kingston, Ottawa, Peterborough, East Region; Kenora, North Bay, Sudbury, Thunder Bay, North Region; Etobicoke, Toronto, Toronto Region; Guelph, London, Owen Sound, Sarnia, Windsor, West Region","Monday, February 17, 2025 11:59 pm EST",,,,,,,,,,,,,,,,
223806,Student – Fire Assistant (14),Various Ministries,$17.20  - $18.05 Per Hour,"Midhurst, Central Region; Armstrong, Dryden, Fort Frances, Garson, Kenora, Pickle Lake, Sioux Lookout, Thunder Bay, North Region","Saturday, January 25, 2025 11:59 pm EST",,,,,,,,,,,,,,,,
223721,Student – Fish and Wildlife Jobs (85),Various Ministries,$17.20  - $18.05 Per Hour,"Bracebridge, Sutton West, Central Region; Codrington, Harwood, Lindsay, Picton, Peterborough, Sharbot Lake, East Region; Dorion, Englehart, North Bay, Redbridge, Rosslyn, Sudbury, Sault Ste Marie, South Porcupine, Tehkummah, Thunder Bay, Whitney, North Region; Chatsworth, Owen Sound, Port Dover, Vittoria, Wheatley, West Region","Tuesday, February 4, 2025 11:59 pm EST",,,,,,,,,,,,,,,,
223778,Student – Geographic Information Systems (GIS) Assistant (22),Various Ministries,$17.20  - $18.05 Per Hour,"Georgetown, Central Region; Kingston, Peterborough, East Region; North Bay, Sudbury, Sault Ste Marie, Thunder Bay, North Region; North York, Toronto, Toronto Region; London, St Catharines, West Region","Tuesday, January 28, 2025 11:59 pm EST",,,,,,,,,,,,,,,,
224188,Ambulance Communications Officer (4),Ministry of Health,$37.36  - $45.69 Per Hour,"Hamilton, West Region","Friday, December 27, 2024 11:59 pm EST",,,,,,,,,,,,,,,,
224019,"Assistant Deputy Minister, Employee Relations and Negotiations (1)",Treasury Board Secretariat,"$192,199.00  - $242,139.00 Per Year","Toronto, Toronto Region","Friday, January 17, 2025 11:59 pm EST",,,,,,,,,,,,,,,,
224137,Assistant Formulary Publication Clerk (1),Ministry of Health,$26.92  - $31.31 Per Hour,"North York, Toronto Region","Tuesday, January 7, 2025 11:59 pm EST",,,,,,,,,,,,,,,,
223908,Case Management Coordinator (1),Ministry of the Attorney General,$34.89  - $41.77 Per Hour,"Toronto, Toronto Region","Friday, December 27, 2024 11:59 pm EST",,,,,,,,,,,,,,,,
223020,Compliance Inspector - Unilingual (English) and Bilingual (English/French) (13),Ministry of Public and Business Service Delivery and Procurement,"$1,348.50  - $1,687.23 Per Week","North Bay, North Region; Toronto, Toronto Region","Friday, January 17, 2025 11:59 pm EST",,,,,,,,,,,,,,,,
223270,Deputy Superintendent Finance and Performance (1),Ministry of the Solicitor General,"$86,330.00  - $127,214.00 Per Year","Penetanguishene, Central Region","Friday, December 27, 2024 11:59 pm EST",,,,,,,,,,,,,,,,
224561,Employer Specialist (1),"Ministry of Labour, Immigration, Training and Skills Development","$1,665.84  - $2,127.84 Per Week","Peterborough, East Region","Tuesday, December 31, 2024 11:59 pm EST",,,,,,,,,,,,,,,,
223852,Financial Officer (3),Ministry of Long - Term Care,"$1,246.48  - $1,525.83 Per Week","Toronto, Toronto Region","Friday, December 27, 2024 11:59 pm EST",,,,,,,,,,,,,,,,
224093,"Information Management Data Analyst, Data and Quality Standards (1)",Ministry of Health,"$71,563.00  - $100,052.00 Per Year","Toronto, Toronto Region","Friday, December 27, 2024 11:59 pm EST",,,,,,,,,,,,,,,,
220996,Policy Advisor (2),Ministry of Finance,"$76,231.00  - $109,842.00 Per Year","Toronto, Toronto Region","Friday, December 27, 2024 11:59 pm EST",,,,,,,,,,,,,,,,
223776,Student – Geological Assistant (13),Various Ministries,$18.05  - $18.05 Per Hour,"Tweed, East Region; Kenora, Red Lake, Sudbury, Sault Ste Marie, South Porcupine, Swastika, Thunder Bay, North Region","Tuesday, January 21, 2025 11:59 pm EST",,,,,,,,,,,,,,,,
223782,Student – Human Resources Assistant Positions (61),Various Ministries,$17.20  - $18.05 Per Hour,"Orillia, Oshawa, Central Region; Kingston, Peterborough, East Region; Sudbury, North Region; North York, Toronto, Toronto Region; London, West Region","Tuesday, January 28, 2025 11:59 pm EST",,,,,,,,,,,,,,,,
223712,Student – Information Management Jobs (36),Various Ministries,$17.20  - $18.05 Per Hour,"Peterborough, East Region; Sudbury, Thunder Bay, North Region; North York, Toronto, Toronto Region; Hamilton, London, West Region","Monday, February 3, 2025 11:59 pm EST",,,,,,,,,,,,,,,,
